key,name,description,title.default,title.en_US,title.de_DE,subtitle.default,subtitle.en_US,subtitle.de_DE,image_url.default,image_url.en_US,image_url.de_DE,click_url.default,click_url.en_US,click_url.de_DE,alt_text.default,alt_text.en_US,alt_text.de_DE
br-1,Big Banner Service,Service promotion redirecting to Services category page.,Services - Reduce Downtime,,Services - Weniger Stillstand,"Maintenance, certified repairs, and on-site support to keep critical equipment running.",,"Wartung, zertifizierte Reparaturen und Vor Ort Service, damit kritische Anlagen zuverlässig laufen.",/assets/static/images/section-slider-item-image-10@2x.jpg,,/assets/static/images/section-slider-item-image-10@2x.jpg,/en/services,,/de/services,Services - Weniger Stillstand,,Services - Weniger Stillstand
br-2,Big Banner Components and Accessories,Components and Accessories promotion redirecting to Components and Accessories category page.,Components & Accessories - Essential Parts,,Komponenten & Zubehör - Wichtige Teile,"Spare parts, fittings, and add-ons to keep operations reliable and maintenance fast.",,"Ersatzteile, Anschlüsse und Zubehör, damit Abläufe stabil bleiben und Wartung schneller geht.",/assets/static/images/section-slider-item-image-6@2x.jpg,,/assets/static/images/section-slider-item-image-6@2x.jpg,/en/components-and-accessories,,/de/komponenten-und-zubehör,Components & Accessories - Essential Parts,,Komponenten & Zubehör - Wichtige Teile
br-3,Big Banner Air Conditioning and Heating,Air Conditioning and Heating promotion redirecting to Air Conditioning and Heating category page.,Air Conditioning & Heating - HVAC Solutions,,Klima & Heizung - HVAC Lösungen,"Energy-efficient units and controls for stable temperatures across offices, warehouses, and production.",,"Effiziente Geräte und Steuerungen für stabile Temperaturen in Büro, Lager und Produktion.",/assets/static/images/section-slider-item-image-7@2x.jpg,,/assets/static/images/section-slider-item-image-7@2x.jpg,/en/air-conditioning-and-heating-solutions,,/de/klimatisierung-und-heizlösungen,Air Conditioning & Heating - HVAC Solutions,,Klima & Heizung - HVAC Lösungen
ssp-br-1,SSP Banner Name 1,SSP Banner Description 1, ,,, ,,,/assets/current/default/images/ssp-promo.jpg,,,/en/demo-landing-page,,,ssp-banner-image,,
ssp-br-2,SSP Banner Name 2,SSP Banner Description 2, ,,, ,,,/assets/current/default/images/ssp-promo-2.jpg,,,/en/demo-landing-page,,,ssp-banner-image,,
