key,name,description,title.default,title.en_US,title.de_DE,subtitle.default,subtitle.en_US,subtitle.de_DE,image_url.default,image_url.en_US,image_url.de_DE,click_url.default,click_url.en_US,click_url.de_DE,alt_text.default,alt_text.en_US,alt_text.de_DE
br-1,Big Banner Service,Service promotion redirecting to Services category page.,Service - reduce downtime,,Services - Weniger Stillstand,"Maintenance, certified repairs, and onsite support to keep critical equipment running.",,"Wartung, zertifizierte Reparaturen und Vor Ort Service, damit kritische Anlagen zuverlässig laufen.",/assets/static/images/section-slider-item-image-10@2x.jpg,,/assets/static/images/section-slider-item-image-10@2x.jpg,/en/services,,/de/services,Service - Reduce Downtime,,Service - Weniger Stillstand
br-2,Big Banner Components and Accessories,Components and Accessories promotion redirecting to Components and Accessories category page.,Essential parts for reliable maintenance and repair,,Wichtige Teile für zuverlässige Wartung und Reparatur,Source the parts and accessories your teams need to maintain uptime across every application.,,"Ersatzteile und Zubehör, die Ihre Teams für zuverlässigen Betrieb in jeder Anwendung brauchen.",/assets/static/images/section-slider-item-image-6@2x.jpg,,/assets/static/images/section-slider-item-image-6@2x.jpg,/en/components-and-accessories,,/de/komponenten-und-zubehör,Components & Accessories,,Komponenten & Zubehör
br-3,Big Banner Air Conditioning and Heating,Air Conditioning and Heating promotion redirecting to Air Conditioning and Heating category page.,Air conditioning & heating - HVAC solutions,,Klima & Heizung - HVAC Lösungen,"Energy-efficient units and controls for stable temperatures across offices, warehouses, and production.",,"Effiziente Geräte und Steuerungen für stabile Temperaturen in Büro, Lager und Produktion.",/assets/static/images/section-slider-item-image-7@2x.jpg,,/assets/static/images/section-slider-item-image-7@2x.jpg,/en/air-conditioning-and-heating-solutions,,/de/klimatisierung-und-heizlösungen,Air Conditioning & Heating - HVAC Solutions,,Klima & Heizung - HVAC Lösungen
ssp-br-1,SSP Banner Name 1,SSP Banner Description 1, ,,, ,,,/assets/current/default/images/ssp-promo.jpg,,,/en/demo-landing-page,,,ssp-banner-image,,
ssp-br-2,SSP Banner Name 2,SSP Banner Description 2, ,,, ,,,/assets/current/default/images/ssp-promo-2.jpg,,,/en/demo-landing-page,,,ssp-banner-image,,
